{
  "$schema": "../schemas/github-ruleset.schema.json",
  "schemaVersion": "1.0",
  "repository": "urruegg/caldova-hr-frontier",
  "repositorySettings": {
    "defaultBranch": "main",
    "allowMergeCommit": false,
    "allowRebaseMerge": false,
    "allowSquashMerge": true,
    "deleteBranchOnMerge": true,
    "hasProjects": false
  },
  "security": {
    "dependabotSecurityUpdates": true
  },
  "rulesets": [
    {
      "name": "main",
      "target": "branch",
      "enforcement": "active",
      "bypassActors": [],
      "conditions": {
        "refName": {
          "include": [
            "refs/heads/main"
          ],
          "exclude": []
        }
      },
      "rules": [
        {
          "type": "deletion"
        },
        {
          "type": "non_fast_forward"
        },
        {
          "type": "pull_request",
          "parameters": {
            "dismissStaleReviewsOnPush": true,
            "requireCodeOwnerReview": false,
            "requireLastPushApproval": false,
            "requiredApprovingReviewCount": 0,
            "requiredReviewThreadResolution": true,
            "allowedMergeMethods": [
              "squash"
            ]
          }
        },
        {
          "type": "required_status_checks",
          "parameters": {
            "doNotEnforceOnCreate": false,
            "requiredStatusChecks": [
              {
                "context": "Repository setup validation",
                "integrationId": 15368
              }
            ],
            "strictRequiredStatusChecksPolicy": true
          }
        }
      ]
    }
  ]
}